{
    "schema_version":  "1.0.0",
    "state_projection_id":  "state.record.decision.p4.001",
    "project_id":  "project.demo",
    "subject":  {
                    "kind":  "record_generation",
                    "subject_id":  "decision.p4.preliminary",
                    "generation_id":  "generation.decision.p4.001",
                    "method_identity":  {
                                            "stable_id":  "method.overlap_stabilized_score",
                                            "version":  1,
                                            "definition_sha256":  "1111111111111111111111111111111111111111111111111111111111111111"
                                        }
                },
    "publication_state":  "formal",
    "record_position":  "current",
    "alignment":  {
                      "state":  "exact",
                      "causes":  [
                                     "exact_match"
                                 ],
                      "assessed_at":  "2026-08-01T15:05:00Z",
                      "assessed_by":  "research_lead",
                      "reasons":  [
                                      "The decision brief summarizes the exact current Phase 4 record."
                                  ],
                      "assessed_method":  {
                                              "stable_id":  "method.overlap_stabilized_score",
                                              "version":  1,
                                              "definition_sha256":  "1111111111111111111111111111111111111111111111111111111111111111"
                                          }
                  },
    "research_attention":  {
                               "level":  "monitor",
                               "open_item_ids":  [
                                                     "attention.preliminary_scope.001"
                                                 ],
                               "reasons":  [
                                               "The current evidence is aligned but scientifically narrow."
                                           ],
                               "next_question":  "Should the researcher authorize a comprehensive Phase 4 run?"
                           },
    "evidence_eligibility":  {
                                 "status":  "not_applicable",
                                 "method_match":  "not_applicable",
                                 "reasons":  [

                                             ]
                             },
    "source_event_ids":  [
                             "event.decision.published.001"
                         ],
    "last_event_sequence":  17,
    "event_root_sha256":  "bbd97f839adacc69bdd2abf826b7b7c4efbc423cbbf9c500073c1458cdbf7666",
    "content_sha256":  "85f55ab6df72bb33056121e8b8eceaebf371a95a7b7b289bd39f35107d3c4e75",
    "computed_at":  "2026-08-01T15:10:04Z"
}
