{
    "schema_version":  "1.0.0",
    "state_projection_id":  "state.record.implementation.001",
    "project_id":  "project.demo",
    "subject":  {
                    "kind":  "record_generation",
                    "subject_id":  "record.implementation.overlap_stabilized_score",
                    "generation_id":  "generation.implementation.001",
                    "method_identity":  {
                                            "stable_id":  "method.overlap_stabilized_score",
                                            "version":  1,
                                            "definition_sha256":  "1111111111111111111111111111111111111111111111111111111111111111"
                                        }
                },
    "publication_state":  "formal",
    "record_position":  "current",
    "alignment":  {
                      "state":  "exact",
                      "causes":  [
                                     "exact_match"
                                 ],
                      "assessed_at":  "2026-08-01T15:02:00Z",
                      "assessed_by":  "theorist",
                      "reasons":  [
                                      "The implementation record identifies the exact code and configuration used for the method."
                                  ],
                      "assessed_method":  {
                                              "stable_id":  "method.overlap_stabilized_score",
                                              "version":  1,
                                              "definition_sha256":  "1111111111111111111111111111111111111111111111111111111111111111"
                                          }
                  },
    "research_attention":  {
                               "level":  "none",
                               "open_item_ids":  [

                                                 ],
                               "reasons":  [

                                           ]
                           },
    "evidence_eligibility":  {
                                 "status":  "not_applicable",
                                 "method_match":  "not_applicable",
                                 "reasons":  [

                                             ]
                             },
    "source_event_ids":  [
                             "event.implementation.published.001"
                         ],
    "last_event_sequence":  17,
    "event_root_sha256":  "bbd97f839adacc69bdd2abf826b7b7c4efbc423cbbf9c500073c1458cdbf7666",
    "content_sha256":  "ec4e411e9b98eada88708105ec7b28ae81e9b3cede71508feec84c51b99bd119",
    "computed_at":  "2026-08-01T15:10:04Z"
}
