{
    "schema_version":  "1.0.0",
    "state_projection_id":  "state.record.empirical.001",
    "project_id":  "project.demo",
    "subject":  {
                    "kind":  "record_generation",
                    "subject_id":  "record.empirical_evidence.overlap_stabilized_score",
                    "generation_id":  "generation.empirical.001",
                    "method_identity":  {
                                            "stable_id":  "method.overlap_stabilized_score",
                                            "version":  1,
                                            "definition_sha256":  "1111111111111111111111111111111111111111111111111111111111111111"
                                        }
                },
    "publication_state":  "formal",
    "record_position":  "current",
    "alignment":  {
                      "state":  "exact",
                      "causes":  [
                                     "exact_match"
                                 ],
                      "assessed_at":  "2026-08-01T15:02:00Z",
                      "assessed_by":  "theorist",
                      "reasons":  [
                                      "The current evidence index uses only evidence generated from the exact method definition."
                                  ],
                      "assessed_method":  {
                                              "stable_id":  "method.overlap_stabilized_score",
                                              "version":  1,
                                              "definition_sha256":  "1111111111111111111111111111111111111111111111111111111111111111"
                                          }
                  },
    "research_attention":  {
                               "level":  "monitor",
                               "open_item_ids":  [
                                                     "attention.preliminary_scope.001"
                                                 ],
                               "reasons":  [
                                               "Evidence remains preliminary and covers a narrow simulation design."
                                           ],
                               "next_question":  "Should the researcher launch a comprehensive Phase 4 run before using the performance claim in a manuscript?"
                           },
    "evidence_eligibility":  {
                                 "status":  "not_applicable",
                                 "method_match":  "not_applicable",
                                 "reasons":  [

                                             ]
                             },
    "source_event_ids":  [
                             "event.record.published.001"
                         ],
    "last_event_sequence":  17,
    "event_root_sha256":  "bbd97f839adacc69bdd2abf826b7b7c4efbc423cbbf9c500073c1458cdbf7666",
    "content_sha256":  "068dfcf6b710d192f4bb7bc8002781ad08e3bf1b2b7d2b177adc7c8e376d46b7",
    "computed_at":  "2026-08-01T15:10:04Z"
}
