{
    "schema_version":  "1.0.0",
    "state_projection_id":  "state.evidence.simulation.preliminary.001",
    "project_id":  "project.demo",
    "subject":  {
                    "kind":  "evidence_item",
                    "subject_id":  "evidence.simulation.preliminary.001",
                    "method_identity":  {
                                            "stable_id":  "method.overlap_stabilized_score",
                                            "version":  1,
                                            "definition_sha256":  "1111111111111111111111111111111111111111111111111111111111111111"
                                        }
                },
    "publication_state":  "formal",
    "record_position":  "none",
    "alignment":  {
                      "state":  "exact",
                      "causes":  [
                                     "exact_match"
                                 ],
                      "assessed_at":  "2026-08-01T15:02:00Z",
                      "assessed_by":  "theorist",
                      "reasons":  [
                                      "Every indexed result was computed from the exact method definition and passed the mathematical-fidelity check."
                                  ],
                      "assessed_method":  {
                                              "stable_id":  "method.overlap_stabilized_score",
                                              "version":  1,
                                              "definition_sha256":  "1111111111111111111111111111111111111111111111111111111111111111"
                                          }
                  },
    "research_attention":  {
                               "level":  "monitor",
                               "open_item_ids":  [
                                                     "attention.preliminary_scope.001"
                                                 ],
                               "reasons":  [
                                               "Evidence remains preliminary and covers a narrow simulation design."
                                           ],
                               "next_question":  "Should the researcher launch a comprehensive Phase 4 run before using the performance claim in a manuscript?"
                           },
    "evidence_eligibility":  {
                                 "status":  "included",
                                 "method_match":  "exact",
                                 "assessed_against_method_identity":  {
                                                                          "stable_id":  "method.overlap_stabilized_score",
                                                                          "version":  1,
                                                                          "definition_sha256":  "1111111111111111111111111111111111111111111111111111111111111111"
                                                                      },
                                 "reasons":  [
                                                 "The computation and definition digests match exactly."
                                             ]
                             },
    "source_event_ids":  [
                             "event.evidence_indexed.001"
                         ],
    "last_event_sequence":  17,
    "event_root_sha256":  "bbd97f839adacc69bdd2abf826b7b7c4efbc423cbbf9c500073c1458cdbf7666",
    "content_sha256":  "8b8b791ab45665aa1a8038fc4b8c6f7d924eae489711d043057f3713b2779905",
    "computed_at":  "2026-08-01T15:10:04Z"
}
